comment_id,text,video_id
UgwirqGN6jiNO9s7ajh4AaABAg,:/ ya van a empezar con los vtubers en este canal como el rubius,iluqNcCJl9g
Ugw44FUfyZDzvyRcyzt4AaABAg,"Grande mi King, que chambeador",iluqNcCJl9g
UgyjgAqk7HftvZqUpjR4AaABAg,"Mi King madrugó pa chambear tempranito, es todo un hombre trabajador y que chingue su madre el 8vv babiraje",iluqNcCJl9g
UgzUTwkaTe7jQYMfKFd4AaABAg,Valiente joven de Tijuana vence estereotipos sociales ante las masas.,iluqNcCJl9g
Ugx4D43ovkb5pIKxkHF4AaABAg,Como le chambeas mi King peepoClap <3,iluqNcCJl9g
UgwxjnPyF7gADf96InF4AaABAg,Grande mi Kin cómo todo un hombre trabajador hoy prenderá Stream también  BabyRage,iluqNcCJl9g
Ugwf5tMtJFnUEfCWIdJ4AaABAg,"Muy bien vídeo, contenido de calidad, este video evito que mi perro se muriera de aburrimiento gracias a la participación furra de el marihuano amigo de todos los niños Skyshock 😎😎😎🥵🥵🥵🤖🤖🤖 dios no existe 🖕🤘😝",iluqNcCJl9g
UgzxnrM0_IRTAROUond4AaABAg,"Un grande mi king, como  siempre igual de trabajador que no te duela la espalda por tanto esfuerzo",iluqNcCJl9g
UgzB4hU9IHRSmBx9DUR4AaABAg,Skyfurro ❤️,iluqNcCJl9g
UgwjNRZom2GvDY5lW4t4AaABAg,los Vtubers furros invaden a la LLA OwO,iluqNcCJl9g
UgxQqN9epNqArWqvzXx4AaABAg,"Arriba yo, mi apa y el furro del Sky",iluqNcCJl9g
UgztiGGKYm8RVGiW3EB4AaABAg,La persona mas trabajadora que conozco mi king <3,iluqNcCJl9g
UgwDxu_3IVr6am1NWS14AaABAg,rugeme,iluqNcCJl9g
UgzlyyaAcLvMjR_ixyJ4AaABAg,:yougotthis:,iluqNcCJl9g
UgymY63PX3kjtFZisG14AaABAg,"Regresanos al kikiriki we, nomas se pasó de huevos un día Sadge",iluqNcCJl9g
Ugy8zRfOn9A5TqpIGvd4AaABAg,puchale pley mi king BabyRage,iluqNcCJl9g
UgyW2tKi4YBe_QfpZ5N4AaABAg,RAWR AYAYA,iluqNcCJl9g
Ugxalfw3RJ61VLL2G_x4AaABAg,En qué parte de Ucrania estás?,WfGkXJjWcR0
Ugyrgeqzv7Xaw2H_GZp4AaABAg,Cómo busco el juego raza :(,WfGkXJjWcR0
Ugw1jKOH4KZ2J_E_zX54AaABAg,"Vengo de tu comentario del video de Adrián Marcelo yo también soy de
Tijuana Saludos jaja",WfGkXJjWcR0
UgwOJuxanFNA5uvAn3l4AaABAg,PILINGA,WfGkXJjWcR0
UgzC0Jd-i4v-QaN_ctt4AaABAg,Skyshock y ezreal nunca han sido compatibles jajaja,WfGkXJjWcR0
UgxzkfMGoeCejj89g7B4AaABAg,"Recien veo un video tuyo desde hace años, literal, hasta ya me casé y todo y pum perra! me tope con un video tuyo... y te ves diferente... flaco se te ve diferente xD",WfGkXJjWcR0
Ugz3l84CYSgp8JpnA254AaABAg,PILINGA,WfGkXJjWcR0
UgyJ-tI6UjL1bbJQsY94AaABAg,No le crean Chad! Yo le estaba pasando las respuestas.,WfGkXJjWcR0
UgxsR7nItaM6ZVSDc7p4AaABAg,"ah caray, me hicieron clickbait, grande mi king",WfGkXJjWcR0
UgwLQX6X4wQzUgrpGbF4AaABAg,Pilinga,WfGkXJjWcR0
UgwwDMnnOo3zUDKP9_B4AaABAg,"Cuanta cultura tiene nuestro King! Increible y grandiosa parte del stream, como con el Majo Tori :v grande Sky",WfGkXJjWcR0
Ugx-RdB3C3Gpg_qf4DJ4AaABAg,"Un instructor de manejo en UK gana más que un profesionista en México
KEKU",WfGkXJjWcR0
UgxkAkFsdTWWZGKMCPJ4AaABAg,Rolen la pagina del test,WfGkXJjWcR0
UgzSbraGJI7Yd4H6vM14AaABAg,"Como le sabe al porno mi king, Grande.",WfGkXJjWcR0
UgwmQj2H_mBZytT4QFN4AaABAg,se quedo bien cocodrilo en el minuto 5:00 KEKW,WfGkXJjWcR0
UgwDRM_YdOfYeL3dSf54AaABAg,Esta parte del stream fue un cague de risa hahahaha,WfGkXJjWcR0
UgxHG-PZNlOCYg5QjpF4AaABAg,Humilde mi king parando a los 36 puntos para no humillar a los del otro barrio peepoClap,WfGkXJjWcR0
UgzoxUNS4woqR8YE5EB4AaABAg,Jajajajaja,WfGkXJjWcR0
UgxCy6H2hjtB4_B_uVp4AaABAg,De risa que no te niegues a las donaciones,WfGkXJjWcR0
UgwQWYCm6Q6O-z74wg14AaABAg,Pilinga para todos,WfGkXJjWcR0
UgyJhfHoz9-8Ac-DdBZ4AaABAg,Mi compa el pajas,WfGkXJjWcR0
UgxTqCbPvG3zih1OeAx4AaABAg,Esta Chido el Morrorles.,WfGkXJjWcR0
UgyhhibawXrIkIdwLtR4AaABAg,Para cuando la próxima guia de campeones  :v,WfGkXJjWcR0
UgxsaAobLNao-GJ76th4AaABAg,como se llama la pagina,WfGkXJjWcR0
UgwAttq3b3VKYnaB_O14AaABAg,Ni los de la otra cuadra saben tanto de LOL como mi king,WfGkXJjWcR0
UgzL7tkYoDM4vI3o1iR4AaABAg,Ban al los spoileros babyrage,WfGkXJjWcR0
UgwslqLeJJIc19wDocF4AaABAg,LOS DE ENFRENTE NO TRAEN NADA,WfGkXJjWcR0
Ugw_6A4O7NAhT_zYU314AaABAg,Spoiler: No le sabe KEKU,WfGkXJjWcR0
Ugx_qWpVIswiWZzuc3V4AaABAg,Títulos que envejecieron bien,RsaExJ-OEKg
UgyeCzNje2KHSgqvzRB4AaABAg,"Muy buenos hablando los casters y muy emocionante, pero creo que subiria mucho la calidad si dijeran algo mas que lo obvio, son como jugadores de oro 3 narrando una partida
Peeeero muy divertido la verdad, es una queja medio mamona.",RsaExJ-OEKg
Ugz8Fxdiq5KqpnfiziF4AaABAg,el flow de este pana @alanq es candela que bueno llegar a un lugar donde te sientes comodo,RsaExJ-OEKg
UgyGP1noMx6eiukxKm14AaABAg,-.- AlanQ,RsaExJ-OEKg
UgwiOCJQ517PvlsBUv94AaABAg,2:50 no puedo LPTM AHAHAHAHAHAHA,RsaExJ-OEKg
Ugy2jUQiXKpbdd80fdN4AaABAg,esta semana estuvo buena y bien entretenida XD me reí mucho,RsaExJ-OEKg
Ugzp1MzjSm_VuQ98v0d4AaABAg,COCODRILO 7U7,RsaExJ-OEKg
UgystTURbAjgQrGih9t4AaABAg,Leí Que ch1ngue su madre el 8vvv de pura costumbre BabyRage,RsaExJ-OEKg
UgwM9hlh8-9U2wevPM14AaABAg,Prefiero perderme los drpos kk a perderme esos casteos god,RsaExJ-OEKg
Ugywxz_foV-QadDRRhR4AaABAg,COCODRILO,RsaExJ-OEKg
UgwuOHxNLSb36O3ArqV4AaABAg,Como la están rompiendo! Cada dia mejor estos tipos!,RsaExJ-OEKg
Ugy9Jp4i-bpZMLdtmn94AaABAg,"Que grandes todos, paso las semanas esperando el fin para ver la LLA con emoción",RsaExJ-OEKg
Ugz7sG2462EV83uNojh4AaABAg,Contenido ilarante,RsaExJ-OEKg
UgwY0uq52V0-Kj-X5lN4AaABAg,esa musica de fondo esta muy rara,RsaExJ-OEKg
UgxSnI_g2Plr6pls1pl4AaABAg,"Shajajajja el clip del 5:00 de Alan es una joya, que grande que le meta esas ganas",RsaExJ-OEKg
UgzmczcOJWbodqmKaYl4AaABAg,Esto no lo tiene ni la LLA.,RsaExJ-OEKg
Ugzu5EpIDdUJrYiSU5Z4AaABAg,#QueChingueASuMadreJerry XDDDD,RsaExJ-OEKg
UgzysoOxXl4lAZUNPHZ4AaABAg,"Sali por fin en los tweets de la transmision de Azteca de la LLA y ahora en el video de Skyshock, me hare influencer.",RsaExJ-OEKg
UgxjcU2shLmIwlUdjaB4AaABAg,COCODRILO,RsaExJ-OEKg
UgxSK9StIlFVLQhvRkJ4AaABAg,De verdad que este casteo si es de Leyenda xD,RsaExJ-OEKg
UgwlF8_KbZ3gEoDgjvR4AaABAg,"Faltó el ""ya sabemos lo que alan Q está comiendo""  y el mame posterior a su éxito de tinder xDDDD",RsaExJ-OEKg
UgxxvCqUjsyUKcG1WQN4AaABAg,De Rubens luego no sabe dónde meterse con cada cosa que dicen Sky y Alan,RsaExJ-OEKg
UgwMLJdSU6OR1dy3tJN4AaABAg,le falto que Skyshock le diga a alan Q que era el MVP  de la partida jajaja,RsaExJ-OEKg
UgxLA9HsuuCmCxomvL14AaABAg,2:50 tremendo cuck jajjajajj,RsaExJ-OEKg
UgzJR5veAeS3TO5ZmYt4AaABAg,A esa todavía ni la vacunan xD,RsaExJ-OEKg
UgzywXQp_N2xHcYZxNN4AaABAg,puros videos mamalones,RsaExJ-OEKg
UgyE2CeYNTDWEJVLQg54AaABAg,Bvoy: Mamalon,RsaExJ-OEKg
Ugzh8Q2O2P9zf1bM2nR4AaABAg,5:00 Que buen rap,RsaExJ-OEKg
UgylJhOmzNz-2iuzxx94AaABAg,Dejo mi: BabyRage,RsaExJ-OEKg
UgzflBW2Bug-oI-TKfR4AaABAg,"la mejor semana hasta ahora, todo un fin de semana cagándome de risa KEKW",RsaExJ-OEKg
UgydO9w5dBhAYSjbXu94AaABAg,ese mamon que le hace UUuuUu 0:10 echa a perder el casteo del sky,RsaExJ-OEKg
UgxAeTRfm8mD43Nr_nR4AaABAg,"Esto era lo único que quería, una buena transmisión, ya me dieron a JJ, a Fahren, dame un día con raytone y xavy Becker y con eso por fin puedo decirle adiós al LOL .
Gracias azteca",RsaExJ-OEKg
UgwwRXvNL40vg3kzMiB4AaABAg,Muy fuerte la musica de fondo :(,RsaExJ-OEKg
UgwR22Z4FSyU1il_E3V4AaABAg,"Los sabados y domingo, ahora son de mandar a ch1ngar a su m4dr3 al Jerry xD",RsaExJ-OEKg
Ugxr2b6JtTjyLzg-C054AaABAg,video mamalón :D,RsaExJ-OEKg
UgwgRuoN3oeiGcpE5pd4AaABAg,"Esto señores son momentos que te llenan de alegria, que sigan asi, animos",RsaExJ-OEKg
UgxGVyWmrMNknGGU9s14AaABAg,que ch1ng3 a su m4adre el Jerry x2,RsaExJ-OEKg
Ugzh2BgQHuNFS2FfSz94AaABAg,4:42 11111111111,RsaExJ-OEKg
UgywUrzXZP6YbMpkt9l4AaABAg,1:12 risas que te dan años de vida.,RsaExJ-OEKg
UgwEfnjtFBlgRYIa4qh4AaABAg,"traigo la mandibula bien torcida, sin embargo, excelente servicio....",RsaExJ-OEKg
UgynSehuv57KonZVRlN4AaABAg,COCODRILO,RsaExJ-OEKg
UgxB5OEVc4AuRFs6lDZ4AaABAg,"Esto es contenido de calidad, no como los del otro lado con sus drops piteros BabyRage.",RsaExJ-OEKg
Ugyyy-powRBRUYNWFjh4AaABAg,"Vengo del futuro, quitenle el celular a AlanQ!!!!!!!",RsaExJ-OEKg
Ugw3Yee00bU02u5MdXl4AaABAg,Mamalon,RsaExJ-OEKg
UgzbMztAb9OQfLZZbpN4AaABAg,Buen Video lo bueno que respeta a jerry ... equisde,RsaExJ-OEKg
Ugwr9TF8wMtijvjSa8h4AaABAg,Salu2 banda,RsaExJ-OEKg
