comment_id,text,video_id
UgzsFl-1kDZAeuvGmYJ4AaABAg,Le sabe mucho mi Kon 😯 ...  🤐No Autorizo 🤐No Autorizo,lnJ7ja7vGR8
Ugzg89SVx7Isq0E7vh14AaABAg,Eres un crack gracias por promover este contenido que tanto asusta a la gente,lnJ7ja7vGR8
UgywnxC65ScSRFMqnON4AaABAg,Don Skyshock mis respetos por tu contenido. Ahora con temas de grandes. Siga así. Y a la espera del proximo,lnJ7ja7vGR8
UgzE1C0EfEqlptoqSRJ4AaABAg,"ya habia dejado de ver al skyshok por chairo y marihuano, pero eh de admitir que aborda muy bien estos temas turbios y me gusta mucho su critica, grande mi king",lnJ7ja7vGR8
UgztfJ2e4arSp8NFiNR4AaABAg,"Wow, este ha sido el relatos clandestinos que mas he ha gustado, escuche los 4 en un solo día de trabajo.
Muchas gracias Sky, ojalá que vengan mas capitulos.",lnJ7ja7vGR8
UgxYEucaaSLnT6tmXmN4AaABAg,Capcom nos lo dijo todo el tiempo y no les hicimos casó 🥲,lnJ7ja7vGR8
UgwCDcfVTG0AMIStnER4AaABAg,Yo viendo lo de brandy mientras me nebulizo por mi asma.,lnJ7ja7vGR8
UgyKzcD8jT71nQJYQSx4AaABAg,"Impresionante, Skyshock, felicidades, gran contenido...
Lastima que te vas a quedar sin amigos...
Pero aquí vamos a estar viéndote y escuchando un poquito de la verdad de este horrible mundo...",lnJ7ja7vGR8
UgxUWPJOGG_K6NuBzmd4AaABAg,"Brandy dice que en 2016, 85% de los Estadounidenses no estaban vacunados o que no tenían su ""esquema completo"", 2022 practicamente todos estamos vacunados...
Nada concluyente, solo una observación.",lnJ7ja7vGR8
UgykV2AX_3pCma5Q31N4AaABAg,Se le va a extrañar mi King... DISCLAIMER:  En caso de una investigación por parte de cualquier entidad federal o similar no tengo ninguna participación con este grupo ni con las pesonas que lo integran. NO AUTORIZO el uso de mi visualización como prueba fehaciente de dicha participación o involucramiento con dicho grupo y me deslindo totalmente de las opiniones y el contenido que muestra el autor de este material audiovisual.,lnJ7ja7vGR8
Ugx--W98u9wa2BDRhnJ4AaABAg,Estaría chido que los capítulos estuvieran en Spotify para escucharlos de camino a la escuela,lnJ7ja7vGR8
UgzHlGfRZeNW3nr2gD54AaABAg,"El vato que entrevistó a la mujer antivacunas ni la dejo hablar, así como chingados le va a responder jaja",lnJ7ja7vGR8
UgwWEsl0_xfdSKCPkuN4AaABAg,Na mi King a ti te autorizo hasta mi cuenta bancaria,lnJ7ja7vGR8
UgxAlCkbK2Xbr6dq3th4AaABAg,"49:00
¿Cómo vas a comparar Bill Cooper con Ashli Babbitt que embistio contra el Capitolio solo porque no gano Trump?
2:49:50 «Englobas todo con lo mismo, eso no es la vida, son casos expecificos» y va Skyshock y hace eso mismo a lo largo del video.
No sé como un canal de videojuegos se volvio otro canal que ""Mundo Desconocido"", una pena.",lnJ7ja7vGR8
UgyHRMA7ueMLHDmKxr94AaABAg,"Muy interesantes los temas, la verdad no conocía los que compartiste.  Un grande mi king",lnJ7ja7vGR8
UgxLJmitR6MGbdcSQCJ4AaABAg,Si autorizo NODDERS,lnJ7ja7vGR8
UgwmVPmx4_9SA0isE-J4AaABAg,No autorizo,lnJ7ja7vGR8
Ugz2GwyXM9EsSLqCPvh4AaABAg,"Anajemtajemta meamotea mo, sem autorização sem autorização",lnJ7ja7vGR8
Ugxfxc65Xid7g4Dns0R4AaABAg,Esto vale oro!,lnJ7ja7vGR8
UgwbUFG74w4ACMDVuLJ4AaABAg,"Que divertido es verte mientras uno fuma, grande Sky. Me voa fumar uno en su honor",lnJ7ja7vGR8
Ugzs-xC5hhjZivU_1eh4AaABAg,Cuando fue este stream?,lnJ7ja7vGR8
UgyuJGB2my4ghDFFn-Z4AaABAg,Mi king cómo siempre siendo el héroe del pueblo y trayendonos la verdad EZ Clap,lnJ7ja7vGR8
UgxOFs2-Zo3rb8wk-814AaABAg,háganle caso a este agitador de conciencias,lnJ7ja7vGR8
UgyLHmCjLGFSknw-bjt4AaABAg,"Aiuda Chad, hay hombre de traje a fuera de mi casa monkaW",lnJ7ja7vGR8
Ugw8vQY9H6zeDKOFklx4AaABAg,que meyo que meyo monkaW,lnJ7ja7vGR8
UgwQjtPxV76u0M_BFpF4AaABAg,"በማንኛውም የፌደራል ወይም ተመሳሳይ አካል ምርመራ በሚደረግበት ጊዜ, እኔ ከዚህ ቡድን ወይም አካል ከሆኑ ሰዎች ጋር ምንም አይነት ተሳትፎ የለኝም, እንዴት እዚህ እንዳለሁ አላውቅም, ምናልባት በሶስተኛ ወገን የተጨመረ ነው, አላውቅም. የዚህ ቡድን አባላት ማንኛውንም እርምጃ መደገፍ. Okayge",lnJ7ja7vGR8
Ugw791J6fZl7JrJdWzZ4AaABAg,Que buen video,lnJ7ja7vGR8
UgwqCETYoaHiwtLaZw94AaABAg,BabyRage,lnJ7ja7vGR8
Ugx5D87WD27Hv3r5IOh4AaABAg,En qué horario habla de esto en su stream??,lnJ7ja7vGR8
Ugz5BVMuxCSf8SksSul4AaABAg,Que le hicieron a mi muchacho ?,lnJ7ja7vGR8
UgzFbwRWSq2URC2IfSN4AaABAg,Tío Sky?,lnJ7ja7vGR8
Ugy85zw5ZpuabgJ25dN4AaABAg,<3 (0),lnJ7ja7vGR8
UgzDcHB4fw6IhbixTph4AaABAg,<3,lnJ7ja7vGR8
UgwV-sO8aqwSk3C5Nzl4AaABAg,fue una jojo referencia!?,ooaa9to_-SE
Ugw79hxinZ_mDlBCctl4AaABAg,Se recontra calentó,ooaa9to_-SE
UgzsOr_c8XyFhUXotaR4AaABAg,Puro mexican power,ooaa9to_-SE
UgwZiHHAYL8e0zR5FTZ4AaABAg,Ari: cagaste,ooaa9to_-SE
UgwK-SmfyU1Wdm0Gp1R4AaABAg,Skyshock el Nancy JAJAJAJJA,-3fe8jMEipE
Ugyc_dNt6qzJpbAWRUd4AaABAg,Salvaría Venezuela u.u,-3fe8jMEipE
UgxhzfdNIQdTc5zYHfh4AaABAg,Por que censuran la palabra Hitler q tontería,-3fe8jMEipE
Ugyn4vYbGBTYuW0zl1t4AaABAg,Te amo mi kin,IeAqa0dgLCQ
UgypYuHZ6guqbolcAYt4AaABAg,Que te panzooo mi king??,IeAqa0dgLCQ
UgwvxA36tcqY5XW4kV94AaABAg,Cómo narrar la lla jajaja me hiciste el día sky,IeAqa0dgLCQ
Ugw_fBw9EMl4qve25uF4AaABAg,Pumas OMEGALUL,IeAqa0dgLCQ
Ugwi33sVAsNIw_ay9jl4AaABAg,KEKW,IeAqa0dgLCQ
UgwXL4tzZFxeD1DECwV4AaABAg,Jajajajaja que putiza,IeAqa0dgLCQ
UgwTwFd4WTg0Krtdabp4AaABAg,Los pumas sufrieron una embolia,IeAqa0dgLCQ
Ugyss23fYX3QpffSifd4AaABAg,No le veo lo gracioso Madge,IeAqa0dgLCQ
Ugzl0T6vRjGk4ApNNEd4AaABAg,10:00 Mas duro que el talon de frodo ajjajajaajajajajaj tu risa me da vida  mi kong,u_dMvRgQ2qg
Ugw7SvVbK5_ilGARUd54AaABAg,"Fan hueso colorado, todos los vi en stream, aguante al toreto de tijuana",u_dMvRgQ2qg
UgwUD_JLzdK2pjUKa_d4AaABAg,Que buen contenido.  Este comentario no es para nada pago :),u_dMvRgQ2qg
UgzgwsrWTeK_Ka2nkjx4AaABAg,El regreso del KING.,u_dMvRgQ2qg
UgxyO_EOl6qyjt2Qhop4AaABAg,Tienes varios se hace meses xd,u_dMvRgQ2qg
UgzuNGmQc-yl3YOmP5R4AaABAg,"Grande el kin se nota que volviste a motivarte, sigue asi la neta me mama tu contenido jajaja",u_dMvRgQ2qg
Ugz1F2J8s5VbOskbLGJ4AaABAg,que buenos momentos <3,u_dMvRgQ2qg
Ugx4MLnTwLsNihj_RRl4AaABAg,ya se extrañaba,u_dMvRgQ2qg
UgzBMyXBXDm1E92dhSJ4AaABAg,Esa plática con el Prof Andres y el del pipazote ¿cúando fué? ¿en qué stream? Un besito al que responda <3,u_dMvRgQ2qg
Ugw6-QJ_skNoCy7kQ9d4AaABAg,Grande mi kong ❤️,u_dMvRgQ2qg
Ugy3CZzHB-2II0uhj814AaABAg,": tu te quedas en tu casa jugando""
Grande Martinoli ❤️",u_dMvRgQ2qg
UgykSNSi8mg6NTkqQV94AaABAg,Revivió el YouTube cabrones!! POGGERS,u_dMvRgQ2qg
UgyUcFotcIuYSGGfFr54AaABAg,entonces no hay stream hoy,u_dMvRgQ2qg
UgyRy4SK2Os-T9esn6d4AaABAg,Deberías colocar las reacciones del chat :chatting:,u_dMvRgQ2qg
UgwGlI4uqvEB3ItMO8N4AaABAg,8:05 se puede ver el momento exacto donde le cae la depresión,u_dMvRgQ2qg
Ugzj1haDTRhGC9ucLrB4AaABAg,"Estoy con un dolor el las costillas, y por tu culpa empeoró ya que no pude aguantar la risa 🤣",u_dMvRgQ2qg
UgzobKbj8rqZaqMseqp4AaABAg,9:05 hahahahahhah la que mato a goliat,u_dMvRgQ2qg
UgxKGkxeUHtmYQqJv5V4AaABAg,Grande mi Kin Okayge,u_dMvRgQ2qg
Ugwvjm8_eMZxYU-F6QR4AaABAg,"hoy no soga, hoy no",u_dMvRgQ2qg
UgxkJGhYH4lVP3D5KmV4AaABAg,Grande mi king <3,u_dMvRgQ2qg
UgxP4lLNyhXDo-U-qz94AaABAg,Que grande el diiiieeeeeegooooooooo,u_dMvRgQ2qg
UgxwmaI4xk5AHzT41CB4AaABAg,0 días,u_dMvRgQ2qg
Ugwa_fp9wvrOC47j6RR4AaABAg,WAAAAAA,u_dMvRgQ2qg
Ugxwpq9YOyRs6ZVmY9h4AaABAg,Contenido de mi nivel 🍷🍷🍷,u_dMvRgQ2qg
UgyWeMBoKS7IZvQLZCR4AaABAg,"que grande mi kong en su regreso numero 101 a youtube, yo siempre te apoyare mi divo de TJ",u_dMvRgQ2qg
Ugxvnnpb07chh9vJtDl4AaABAg,waaaaaaaaaa,u_dMvRgQ2qg
UgxoDXQ4s6o7QjpITVR4AaABAg,10/10,u_dMvRgQ2qg
UgyL6ZCEEqjFvACmF2B4AaABAg,5:07 como me cague de risa con esto 😂,u_dMvRgQ2qg
UgxcAAo19JaaVS-Pfft4AaABAg,O rei do contenido 😎,u_dMvRgQ2qg
Ugyt2_eNyK6bOwNHFVx4AaABAg,"Que buen video, cómo siempre mi king de TJ",u_dMvRgQ2qg
UgykxcjrxdHQTPtQvu14AaABAg,"Grande skyshock A.K.A. El divo de Tijuana, el ass del videogaming, o rei do minijogo, mr 48%, el pilingon, mi King ❤️",u_dMvRgQ2qg
Ugwsw-Ol9H9Sync_ooV4AaABAg,"Ya extrana este tipo de videos, que bien contenido 😎🍷",u_dMvRgQ2qg
Ugwc0x3p-tdOsI-ovLt4AaABAg,Waaaaaaaaaaaaa,u_dMvRgQ2qg
UgxPd7HFTqkhbkHxvrJ4AaABAg,Jajajaja me divertí mucho viendo este contenido,u_dMvRgQ2qg
Ugx2OYPGK6TTySWxYzd4AaABAg,"Muy buen video, contenido de calidad.  🤖",u_dMvRgQ2qg
UgzvAdBt04mTnVcT5jh4AaABAg,Como le chambea mi King PeppoClap,u_dMvRgQ2qg
UgyafNrle9VwUunrOD14AaABAg,Contenido de calidad,u_dMvRgQ2qg
UgxUNzaTDLTYaEJ39NB4AaABAg,0 días sin mencionar a TJ,u_dMvRgQ2qg
Ugyw6xu4XH_9nkiPOr54AaABAg,mi kin se consiguió un editor o porque tanto contenido derrepente?,u_dMvRgQ2qg
UgwKZwxfzivagtN5qfx4AaABAg,"En caso de una investigación por parte de cualquier entidad federal o similar, no tengo ninguna participación con éste grupo o con las personas que forman parte de él, no sé cómo estoy aquí, probablemente agregado por un tercero, no apoyo ninguna acción por los miembros de éste grupo.En caso de una investigación por parte de cualquier entidad federal o similar, no tengo ninguna participación con este grupo ni con las personas que lo integran, no sé cómo estoy aquí, probablemente agregado por un tercero, no apoyo ninguna acción por parte de los miembros de este grupo.",u_dMvRgQ2qg
UgyMDOalecHf0pKP_dN4AaABAg,Grandee mi kon tan chambeador,u_dMvRgQ2qg
Ugzpid-8rAiMQeydPrh4AaABAg,primer comentario soy tu idolo,u_dMvRgQ2qg
Ugy8D4vad1LrP17PW2h4AaABAg,Grande mi kong,u_dMvRgQ2qg
UgxRRe_SLOTqhYQMeRd4AaABAg,uuuuwwaaaaaaaa ***grito de mario***,u_dMvRgQ2qg
UgxligRpTI5RmlA-3Ll4AaABAg,"Gracias, mi kong, por este bello contenido que aún no veo pero seguramente me gustará.",u_dMvRgQ2qg
Ugy4i2uzKPIrh7dJOwV4AaABAg,wooooooooooaaaaaaaaaaaaaaaaaaaaaaaaaaaaaaaa,u_dMvRgQ2qg
UgyOeWpzrPc4DFa7xJJ4AaABAg,Kiubole,u_dMvRgQ2qg
UgxAMU6jRaIakzleFl94AaABAg,Que buen susto hasta te saco del juego xD,lRGQD6h8_Nc
UgwgDrX-INZTE34jMXF4AaABAg,Su gritillo jaja,lRGQD6h8_Nc
UgyIgNeuT4tcFRfdl2x4AaABAg,"JAJAJJAA
El grito weee",lRGQD6h8_Nc
UgzlMK4miqGjWDgrUuR4AaABAg,JAJAJAJA yo estuve ahí,lRGQD6h8_Nc
UgykAvn43NBIiqqbNQ14AaABAg,Como me encanto este strean jajajaja,lRGQD6h8_Nc
UgyfgScIf1iR7HhhmSF4AaABAg,échese un grito compadre!,lRGQD6h8_Nc
UgzF6wAmcsN9oMU_xoR4AaABAg,Me pasó con un zombie en Minecraft me da hasta vergüenza decirlo,lRGQD6h8_Nc
Ugwb7UuTEgKxe4UHjOl4AaABAg,Que grito tan masculino mi kon,lRGQD6h8_Nc
Ugyych0kyu5OBncNIFV4AaABAg,😂,lRGQD6h8_Nc
UgxUDfuhQc9ZfYTZnfx4AaABAg,grito primal,lRGQD6h8_Nc
UgxqjLNkxMeTtVhyfBB4AaABAg,Hasta acá huele,lRGQD6h8_Nc
UgyM_Prw8ziYKWY19ZF4AaABAg,JAJAJAJAJAJA TE MAMASTE,lRGQD6h8_Nc
Ugx1o6Pn0JLxxFm_AtR4AaABAg,Cuando por fin vas a matar a la cucaracha que vienes trackeando por horas pero empieza a volar Sadge,lRGQD6h8_Nc
UgyrW3ZBT_mxlDPyPmJ4AaABAg,😒😑,jLnVziOgUao
Ugx4jPAPA2SCelK0S7d4AaABAg,Aaaaaaaaaaa,jLnVziOgUao
UgzqDSLNLqdKqcssM7l4AaABAg,ese caballo le gusta que le rasquen okayge,jLnVziOgUao
UgyDoFZrDOjQUVeYRDx4AaABAg,Aaaaaah,jLnVziOgUao
UgyUMQcM97w24JQ-1AJ4AaABAg,jajajajaj,jLnVziOgUao
Ugx3CTl-2XX8EE3adCR4AaABAg,Le gusta que le rasquen al 🐎 Juan peepoClap,jLnVziOgUao
UgzchSOnPYwuylTp-KJ4AaABAg,Aaaaaaaaaa,jLnVziOgUao
Ugz8d0bkKF31reoUBbd4AaABAg,todo perfecto solo quiten la musica o bajenle un chingo esta demasiada alataaaaaaaaaaaaaaaaaaaaaa...  gracias,XM7ngkayV-o
UgyLOGymRU2Hg8RQdrF4AaABAg,A mi me gustan los videogames,XM7ngkayV-o
Ugw4LfHgkFZvnjqVwk14AaABAg,Amamamamamamma XD,XM7ngkayV-o
Ugxt_51LARZami4o44p4AaABAg,Este streamer es el verdadero genio,XM7ngkayV-o
UgwbT90xdxlYzSuj3FF4AaABAg,"Namás bájale un poquito a la música spirit babyrage, pero bien vídeo",XM7ngkayV-o
UgzA7JgVtjyTsgo-02F4AaABAg,Mama ponme un local para poner unas maquinitas,XM7ngkayV-o
Ugyy9VwUg15PbMuRFKl4AaABAg,"Una foto sky por favor, una fotoooooo!!!",XM7ngkayV-o
UgxckFHPFS7a_55NAmF4AaABAg,"puras pinches mamadas sube este wey, como se llama alguien sabe?",XM7ngkayV-o
Ugwv4Ot8sRHQSvgl_Op4AaABAg,Salaberga Skyshock aún existe!,XM7ngkayV-o
Ugy9nwE2qNKqqpmYXJx4AaABAg,Entonces mis certificaciones de Jarvar no me hacen un genio? 😥,XM7ngkayV-o
UgywNQmZeOZ30aQa5FN4AaABAg,Un streamer de mi categoría 🤓🍷,XM7ngkayV-o
Ugy5txzhzzZ6Cg7gfWp4AaABAg,"Extrañaba mucho los videos. 
Me paso a los streams cada que puedo. Lo haré más seguido. 
Te quiero mucho Erick de Tijuana.",XM7ngkayV-o
UgzPkrkw-ielf58M53J4AaABAg,"Bajale a la musica del yoshi we, que no oigo",XM7ngkayV-o
UgyoZEr8myKzs9e5p4x4AaABAg,"Muchas gracias por el contenido que aporta mucho a esta sociedad en decadencia, una vez más reitero mi agradecimiento a mi Kong",XM7ngkayV-o
UgzCFH9FKV6f6UDX32x4AaABAg,Mas contenido de mi categoría? tenga su buen like buen hombre,XM7ngkayV-o
UgwNcwvS2nJ50E1jdh14AaABAg,"¿Qué es lo que ven mis ojos? Mr. 47%, Mi King, El Héroe del Pueblo lo ha vuelto a hacer, el pináculo del contenido audiovisual en la industria del videojuego.",XM7ngkayV-o
UgwWRITGEHOkfM2wxnd4AaABAg,"Ya era hora de ver Videitos por aca , Extraño la hora del Diablo 👹 Sadge",XM7ngkayV-o
Ugyicos4S9DoUdi-5sN4AaABAg,El rey a vuelto ._./,XM7ngkayV-o
UgyXMT2aD6wrl0tR1nB4AaABAg,Awebo ya esta regresando el kin :'),XM7ngkayV-o
Ugx70wQs2Fm2QT4p-e14AaABAg,🥵,XM7ngkayV-o
UgztcmgO_pxbGXHsGSx4AaABAg,"FINALMENTE, algo de CONTENIDO de CALIDAD en esta plataforma!",XM7ngkayV-o
Ugz5moCBAb13KvrN_Ot4AaABAg,Mi mamá no tiene local Babyrage,XM7ngkayV-o
UgzIx90ClEw3myyxmaB4AaABAg,"HEY! no heches por tierra el cambiatumismismo y el elqueespobreesporquequiereismo, son las religiones con mas seguidores de la vida, respete señor!!",XM7ngkayV-o
Ugyk3XMO55fo1s3YBrd4AaABAg,BoneZone,XM7ngkayV-o
UgyiuCFI9m_zGL1S5Bx4AaABAg,Eh we quítale la música se oye bien culero así BabyRage,XM7ngkayV-o
UgyRiVJDa4gO5P8KZiF4AaABAg,Muchas gracias por estos clips,XM7ngkayV-o
Ugz57OK9x5JdDvubIKF4AaABAg,"luego no puedo ver los strims' y estos clips son oro puro, sube mas mi kong",XM7ngkayV-o
UgztEgP_SDnbtoZC07V4AaABAg,c le rebentó la tacha mi kin XD,XM7ngkayV-o
UgxrqJOmworg8LFrDbp4AaABAg,Como le sabe al baiteo mi Kon BabyRage,XM7ngkayV-o
UgzEoTyUIqyJr_cXv694AaABAg,"Por fin. Contenido audiovisual de mi categoria.
Muchas gracias mi King.",XM7ngkayV-o
UgzZlpgKjyDC8VRpW_Z4AaABAg,We yo tengo certificado del MIT online en ingeniería aeroespacial 😢😢😢,XM7ngkayV-o
Ugx_FioEh0CNpoBYzk14AaABAg,"Excelente lugar, buen servicio Okayge",XM7ngkayV-o
UgyHwp06FOGWtYf6At94AaABAg,Excelente contenido audiovisual,XM7ngkayV-o
UgxGoEpxm5Iyn7Nb0x54AaABAg,Saludos a mi kong que anda bien mimido,XM7ngkayV-o
Ugz0mA3AQyouDzmB_MN4AaABAg,"E Wee, salúdame weee! ❤️",XM7ngkayV-o
Ugxt0kH8N6vzCkVrdch4AaABAg,Primero,XM7ngkayV-o
Ugx2i7nd8ZEXwQxSLBd4AaABAg,Pero lo lootee XDXDXDXDXD,R1ynVFhIqFs
UgybYDgrPYJQvKGB5Dh4AaABAg,El rey del minigame lo hace de nuevo,R1ynVFhIqFs
UgyG8zcBMECjsXAAX1J4AaABAg,"Que grande mi Kin, enseñándole valiosas lecciones a las nuevas generaciones",R1ynVFhIqFs
UgxIs549ihvtMxrLkxF4AaABAg,JAJAJA esto en vivo fue una joya,R1ynVFhIqFs
Ugxulz8jZ7uPooxjNWR4AaABAg,Que paso con el casteo de lol?,R1ynVFhIqFs
UgwBmjGU2adROlxcPyF4AaABAg,"SKY, estuve buscando un video que subiste hace años y no lo encontré, donde comentabas sobre los 7 campeones mas op de todos los tiempo del lol.",R1ynVFhIqFs
UgwzcuLY3fQPsnJFoa14AaABAg,ay nooooo!!!!!!,R1ynVFhIqFs
UgyC81pyOCWKvnIRBa54AaABAg,"No manche mi kong , soy el sub 350,000 salúdeme mi rey kong",R1ynVFhIqFs
Ugxm6ErZZMwgu_bk-ER4AaABAg,"Ganaste
Pero a qué costo?",R1ynVFhIqFs
Ugwwwr0sNbHZGUS-J3N4AaABAg,Nooooo que mal :'(,R1ynVFhIqFs
UgzUSpXvbfn5BicUuv54AaABAg,😂😂,R1ynVFhIqFs
Ugw8T_TGPHOuhaDZNFp4AaABAg,Cuenta de cuando lootiaste los trajes de las oficinas de Riot LatAm,R1ynVFhIqFs
UgxZY1juzAN0t8cc40R4AaABAg,Ganaste en su nombre :(,R1ynVFhIqFs
UgyqyqA0SeQo6HySwpp4AaABAg,hazle un homenaje we no seas qlo BabyRage,R1ynVFhIqFs
UgyTJ-iDJiiurtT24YR4AaABAg,También hiciste llorar a un abuelito menopausico xd,R1ynVFhIqFs
Ugx5peZntPa1D1mFFE94AaABAg,Ya sabemos que Sky será de los que se van por cigarros 🥺,R1ynVFhIqFs
UgwBahgcEuMBIJA8hxh4AaABAg,Free loot 👍,R1ynVFhIqFs
UgzqDsctnQOLPRqbIVh4AaABAg,Bien sadge el morro jajaja lo merecia,R1ynVFhIqFs
UgxY9Kxl51JS6wD83dZ4AaABAg,No puedo estar más orgulloso del próximo presidente de la República del Chad. Sabes tomar buenas decisiones.,R1ynVFhIqFs
UgyriphvCqh8ssQIsKN4AaABAg,Esta lloviendo? :_(,R1ynVFhIqFs
UgxMSQMvqRWPW3XAuzN4AaABAg,"Ese es tu ídolo?
Eso mío si",R1ynVFhIqFs
UgzAinlphRhcDZSnFLZ4AaABAg,Sadge ya me jodi el Dia :( ... Pero almenos Ganaste Okayge,R1ynVFhIqFs
Ugyhod4zedGFhtiY_TN4AaABAg,"Tremendos bots con IA que hasta hablan, pa mi  que son como los franceses jajaja",R1ynVFhIqFs
UgwtbpAiZzjWZeUhZnd4AaABAg,Revivió el canal POG,R1ynVFhIqFs
UgxxkRhHnrU3F4lC1IN4AaABAg,Compañerooooo 😢 ojalá algún día lo encontremos,R1ynVFhIqFs
UgyXycuB27IwRUaTFw54AaABAg,E we y los vídeos de cuando hacías ejercicio,R1ynVFhIqFs
Ugyh8g4Za-5xOv1YImR4AaABAg,jajajaja pobre niño :(,R1ynVFhIqFs
UgzbnKRqQpt0LeR3tX54AaABAg,Yo tengo a libro del perrito de los chicos del pórtico 🎉❤,rGFUJiKoUas
UgxyKstxyNTiJsssaoJ4AaABAg,JAJAJAJAAJ te mamaste my skyshock,rGFUJiKoUas
UgwzLd0Ki3b5dTCigtN4AaABAg,XD,rGFUJiKoUas
UgyscTuCHuQZi9FsI1t4AaABAg,Que lindo te feĺicito eres divertido si ser vulgar.o prosaico.te mando un abrazo mi niño.😁,rGFUJiKoUas
UgytbhUO5weB-pUg4Jp4AaABAg,Puras facts,rGFUJiKoUas
UgynSNnN6_YO7_CqVkt4AaABAg,Pa cuando sky rapeando en la ceremonia de apertura de la final de la LLA,rGFUJiKoUas
UgxKAldHk8oIiKnWJip4AaABAg,🔥 🔥,rGFUJiKoUas
Ugzzi9mbEYOJe0rWPwB4AaABAg,skyshok rap,rGFUJiKoUas
Ugwfz13_SACrn-OXORZ4AaABAg,"no puede ser, es el joven del tiktoks 😮",rGFUJiKoUas
Ugw80dvrC1KcPCDaK7N4AaABAg,todo sea por los changuitos :D,rGFUJiKoUas
UgzkJGIxM4jhbEwBhmp4AaABAg,Madres... yo leí esto de morro y me sentí muy mal solo de recordarlo.,rGFUJiKoUas
UgyGhrT2xZbRsP-37Rl4AaABAg,que grande mi king Okayge,rGFUJiKoUas
UgzYdvC7eWjpSRPTut54AaABAg,Quality Content.,rGFUJiKoUas
UgxVdCg2C91yfTf5yTN4AaABAg,Díganle a mi King que hay tengo el estudio a su disposición por sí quiere sacar su demo,rGFUJiKoUas
Ugys8xPNmaWKPm1sl_p4AaABAg,Bien viral mi kong Okayge,rGFUJiKoUas
UgzO-u1BO6lzi6y_2b94AaABAg,Top 7 raperos a los que Aczino teme enfrentar:,rGFUJiKoUas
Ugz5Ve5pZtIy4DFZqhR4AaABAg,El KONG se ha manifestado en YouTube ¡TIEMBLEN!,rGFUJiKoUas
UgzfWj_tm826pvLwJVp4AaABAg,Mi King sobreexplotado su Hit de Tik tok,rGFUJiKoUas
UgwAts6_f1uWCPY-4Bt4AaABAg,"Ja ja ja ja que cortito me pasaron el cuentito, no puede ser me voy pal ratito, porque ya no puedo seguir con esto, yo me manifiesto en esto la encesto mira como soy un maestro. 😎 ♫♪♪",rGFUJiKoUas
Ugyi-nyXZMglk2xazLh4AaABAg,Ya llegó el rey de YouTube shorts,rGFUJiKoUas
UgxgWJov6eFrNGvQrKN4AaABAg,"Y decían que mi kin no había ido a la escuela, idulo",rGFUJiKoUas
UgxYK5k2iVF4F27-wm54AaABAg,Pura calle y flow este temazo,rGFUJiKoUas
UgzjsOhOeQ5C2mxje4B4AaABAg,Ganando como siempre mi king 🔥🔥🔥,rGFUJiKoUas
UgyawEZa4HH3ojJHfcx4AaABAg,Grande mi King! El divo de TJ!,rGFUJiKoUas
UgzhjwSfIUmvbw2k2d94AaABAg,Ahora el del ratón 🤣,rGFUJiKoUas
UgzRm56IIo_IQr63x-p4AaABAg,Finalmente... Puro contenido de MI categoría. Ez Clap,rGFUJiKoUas
UgwzJu7cR98A8sN4rM94AaABAg,Que grande mi Kong 😎🙌,rGFUJiKoUas
Ugxl6LbcvrPR252A3814AaABAg,"Ayer fue tiktok, hoy YouTube, mañana los Grammys EZ",rGFUJiKoUas
UgxKq9s19oHjFNSE3r14AaABAg,Recuerdo desbloqueado. Tremendo 🔥,rGFUJiKoUas
UgxoDFSohg2MD5UCKZN4AaABAg,El señor Erick de Tik Tok POGGERS,rGFUJiKoUas
UgyIydMfsUusjkpOlWB4AaABAg,"La única manera de extrañar la primaria pública alb, muchas gracias mi kon❤",rGFUJiKoUas
UgxaKwFqoTm_q2rZ1AN4AaABAg,El mejor maestro de escuela primaria de México:,rGFUJiKoUas
UgzoOMBhWvGn3W0LTd94AaABAg,Ese mi Kong si le sabe POGGERS,rGFUJiKoUas
UgwLyRcTvdKmlrq6tyx4AaABAg,Estuvo bueno ese stream 😎🎤 grande mi kong,rGFUJiKoUas
UgyIbpuZO_Zg6bt2l6F4AaABAg,Ya también hay yt shorts? POGGERS,rGFUJiKoUas
UgxEoE5kgXl3g96Ekdh4AaABAg,Rolón,rGFUJiKoUas
UgwdHcXnK7Ck51NBnbV4AaABAg,Tiembla Residente,rGFUJiKoUas
UgylnfmUfpRWqed87Zp4AaABAg,Hora de cambiar el ringtone,rGFUJiKoUas
Ugw2Kj51SvPE4zNWkJV4AaABAg,Un triunfo más de la educación pública,rGFUJiKoUas
UgzsvqRQyDC2kzZAtDZ4AaABAg,Mejor que bad bunny ❤️🥵,rGFUJiKoUas
Ugw8sWT-XVMI25LmMVB4AaABAg,"hmmmm, I just noticed I was tagged in this video????",Tz-xl3q2OoU
UgwW96dSJ5D70-r5agp4AaABAg,Un gusto haberte conocido................................. see you brou.........................,Tz-xl3q2OoU
UgzFr8PDDQB5FCs_SSt4AaABAg,Criss w2m te barrio 😈 enterrau,Tz-xl3q2OoU
Ugwm5ranLNx4AhfpqFV4AaABAg,"Hace mucho deje de seguir este canal, me gustaban los videos de antes de que skyshock trabajara para riot games, buenls recuerdos de mi epoca jugando wow pero ya murió el canal",Tz-xl3q2OoU
UgyMlCEi-6L33nKMxg54AaABAg,che contenido muerto,Tz-xl3q2OoU
Ugw5WOmGNonc5w_hM554AaABAg,Zzz,Tz-xl3q2OoU
UgyfBHj2X1q1teb7Lph4AaABAg,Pilingoneeee,Tz-xl3q2OoU
UgxMWz9fJvqJSJG4bdp4AaABAg,Gran video eres un crak saludos desde Venezuela epico,Tz-xl3q2OoU
Ugwyrpgt0fCN0_5uNid4AaABAg,Me das corazón wapo??,Tz-xl3q2OoU
UgzZlmMI7csUY40gjZ14AaABAg,"Bro, una duda cómo se llaman tus auriculares ??",Tz-xl3q2OoU
UgxmSeR-6mZ-znwAioB4AaABAg,"Otro video de Skyshock, otro trabajo cinematográfico impecable",Tz-xl3q2OoU
Ugx7vVW82eLWzJqA8VN4AaABAg,Delta es 1- BabyRage,Tz-xl3q2OoU
Ugxi5_qyKKas5ABeTIh4AaABAg,PilinGOD of mischief PeepoClap,Tz-xl3q2OoU
UgzBkaBtTIa-Zv-QYKp4AaABAg,"Aun estoy enojado por que no dejaron entrar al 2070 
Queremos vernos a nosotros wee BabyRage, agrega un cuadrito con los comentarios de la comunidad Chadiana",Tz-xl3q2OoU
UgzPnCHBSZ5FGVHqWcJ4AaABAg,"Estoy como el tío sky, no entendí una wea",Tz-xl3q2OoU
Ugw8fUSMr9zYbtCMHRJ4AaABAg,No pueden acusar al alka por que se arde pinche viejito jajajajaj,Tz-xl3q2OoU
Ugz-4Lo2U4F7IGFkcGV4AaABAg,faltó la parte del gonorrea lo dijo con todo su odio la vita XD,Tz-xl3q2OoU
Ugz0U1c_f5NCtT97szd4AaABAg,Hubieran puesto la carreada del zilverk a la coco jaja todo pendejo,Tz-xl3q2OoU
Ugxog-gP3Gmqbl73ZJ94AaABAg,Y el resumen de la semifinal de lol!? BabyRage no la pude ver :(,Tz-xl3q2OoU
UgywVzFqBUIHIzq7iO54AaABAg,"Lugar muy agradable mi king 🤖
Estuvo bueno el stream tío Skyshock 🍆🍌💦😈",Tz-xl3q2OoU
UgwBAwJQ1zSrCiSNaHd4AaABAg,Hay que estar mariguano para ser un buen detective PepoG,Tz-xl3q2OoU
UgwEHZpBDwzQCAJWzUZ4AaABAg,Grande mi king el amo de los engaños y el humo,Tz-xl3q2OoU
UgyShZFPLYPadCAXfR54AaABAg,Sube uno de las veces en el que el delta fue el 3er impostor,Tz-xl3q2OoU
Ugze0qoKQtFEnFKE5xV4AaABAg,Que hora son weee,Tz-xl3q2OoU
UgwI6WdnaZH7WICnIlp4AaABAg,El Ruking bien desorientado xd,Tz-xl3q2OoU
UgyKEgquB8AnutLs2uR4AaABAg,"Hubieran puesto los clips del Delta siendo el 3er impostor, se paso de burro el profe.",Tz-xl3q2OoU
Ugz4dJnzJQzP5kJAD1p4AaABAg,"bastante bien tu metafora sobre la inmigración mi king, 10/10.",Tz-xl3q2OoU
UgymGvlp1MI6aNG9OFl4AaABAg,muteateeee weeee :babyrage,Tz-xl3q2OoU
UgygF5ezdXzAtxCVTZ54AaABAg,Gran video 👌❤️🤡,Tz-xl3q2OoU
UgyNVmB95MWpmpUzJr54AaABAg,Gran video mi King,Tz-xl3q2OoU
Ugw4FwkKBO0_JFqgu7R4AaABAg,"increíble película, logró adaptar el libro a la perfección, sin duda alguna mi tío difunto (el cual me enseñó el libro) estaría muy orgulloso de ver esta semejante obra de arte ❤️",Tz-xl3q2OoU
UgzMd0z7k5VULIvwTE54AaABAg,Lugar muy agradable 🤖,Tz-xl3q2OoU
Ugwvx4kJpcNBKHNFHhl4AaABAg,Este video me metió y saco de las drogas,Tz-xl3q2OoU
UgzYU-N_hM54JyFouG94AaABAg,Como extraño a mi King con el AlanQ albureandose al Darkoz... Diganle a TV Azteca que los vuelvan a contratar,iluqNcCJl9g
Ugyl8v8d4aEvgDxe4V94AaABAg,Pinches videos qleros que sacas,iluqNcCJl9g
UgylZk0F2EKJPdSkdqV4AaABAg,El mejor,iluqNcCJl9g
UgxrOBw_WfP3-k_xAmF4AaABAg,jajajajajaja se te extrañaba casteando lolsito tio skychok te mando un beso,iluqNcCJl9g
UgzcjWQWAN6HJx-6Xqh4AaABAg,Jajajaja grande skyshok saludos desde venezuela se te Extrañaba esto si es Lol xD,iluqNcCJl9g
UgzIRee0nlmi5ADr9E94AaABAg,LOBITO,iluqNcCJl9g
UgxJtDEv0qM2ie9KNKJ4AaABAg,Saquen la Ramera!!! Jajajajajajajajaja,iluqNcCJl9g
Ugz6Kfj2HVY0A9ejCj14AaABAg,"Un furro, un calvo y un argentino

Tremenda combinación",iluqNcCJl9g
Ugy3alP5KpWpZQQUKtF4AaABAg,Skyfurro para octubre babyrage,iluqNcCJl9g
UgzIIugqulyfP5M6-UF4AaABAg,"Grande mi King con sus ocurrencias!!! Sangra Riot LATAM que mi King es superior en todos los aspectos! 
Excelente transmisión una vez más",iluqNcCJl9g
Ugwau2XY91GcoVlnKFR4AaABAg,soy un furro enamorado de vooooooos,iluqNcCJl9g
UgzHxfEm0VFrtBx8s554AaABAg,Furrosky xd,iluqNcCJl9g
UgxvT07JjSGQV5AVPJ14AaABAg,El furro que podía volar,iluqNcCJl9g
Ugyoiodh7_px-LIVaF94AaABAg,sacamos la ramera jajajajajajaj,iluqNcCJl9g
UgwJD3lREqxiIjjN5pF4AaABAg,Necesitamos más de sky furro,iluqNcCJl9g
Ugy1SukrAuBDlZ7DEDx4AaABAg,increíble impresionante,iluqNcCJl9g
UgwtaVqMnfbs9053RKd4AaABAg,Rawr,iluqNcCJl9g
UgzbxaWlJF3RNcaq7oh4AaABAg,"Otro fin de semana entretenido con Sky, Jj y Darkoz, excelente!! Es como estar con los cuates",iluqNcCJl9g
Ugwzyq0EMJ5QJN2Y5-54AaABAg,No me gustan los furros pero al skyfurro si me lo doy 😍😘,iluqNcCJl9g
UgyYZ729QXJuBlSsk2J4AaABAg,"Un grande mi king, al fin mostrando sus gustos, de admirarse",iluqNcCJl9g
UgwjpTxYJuGmGw7_K2J4AaABAg,XD,iluqNcCJl9g
UgyHUpreIE2gs0-UdV54AaABAg,El cotorreo del tio sky es lo mejor,iluqNcCJl9g
UgxftgNeSTvR1RZFG794AaABAg,Cómo le trabaja mi King peepoClap,iluqNcCJl9g
UgzQFlCxwmCxt75m-Kt4AaABAg,"en este momento 3 personas le han dado dislike, todo bien encasa a esas personas ?.... dejando eso de lado se la rifan con estos resumenes !!! bien chingo que es la lla",iluqNcCJl9g
UgzlYk2ZXxoJ_EJhBYh4AaABAg,Y megumin,iluqNcCJl9g
Ugwm78tE-HZO-P9Bf3x4AaABAg,"Estoy cansado de este mundo, de sus furros",iluqNcCJl9g
Ugyc1gQ_Lr4CvlhcdTB4AaABAg,"Pero agrega los chistes doble sentido y las albureadas mi King, falto el ""sacame de una duda"" Babyraje",iluqNcCJl9g
